{
  "@id": "http://localhost:8080/Plone/a-poll/@poll",
  "uid": "0f2c6e1a9b8d4c3e8f7a6b5c4d3e2f1a",
  "state": "open",
  "allow_anonymous": true,
  "anonymous_blocked": false,
  "show_results": "after_vote",
  "results_graph": "bar",
  "options": [
    {
      "option_id": 0,
      "description": "Yes"
    },
    {
      "option_id": 1,
      "description": "No"
    }
  ],
  "max_choices": 1,
  "legend": null,
  "shuffle_options": false,
  "close_date": "2026-01-01T12:00:00+00:00",
  "expired": true,
  "can_vote": true,
  "has_voted": false,
  "total_votes": 3,
  "results": [
    {
      "option_id": 0,
      "description": "Yes",
      "votes": 2,
      "percentage": 0.6666666666666666
    },
    {
      "option_id": 1,
      "description": "No",
      "votes": 1,
      "percentage": 0.3333333333333333
    }
  ]
}
